title,price,start
"Amazon Basics - 27 Inch IPS Monitor 75 Hz Powered with AOC Technology FHD 1080P HDMI, Display Port and VGA Input VESA Compatible Built-in Speakers for Office and Home, Black",$96.83,4.5 out of 5 stars
"KOORUI 24 Inch Computer Monitor -FHD 1080P Gaming Monitor 165Hz VA 1ms, AdaptiveSync Technology, LED Monitors with Ultra-Thin, HDMI X2 /DP, VESA Compatible, Tilt Adjustable, Eye Care 24E4",$89.99,4.4 out of 5 stars
"SAMSUNG 27"" Essential S3 (S36GD) Series FHD 1800R Curved Computer Monitor, 100Hz, Game Mode, Advanced Eye Comfort, HDMI and D-sub Ports, LS27D366GANXZA, 2024",$119.99,4.6 out of 5 stars
"Acer KB272 E0bi 27"" IPS Full HD (1920 x 1080) Zero-Frame Gaming Office Monitor AMD FreeSync Technology Up to 100Hz Refresh 1ms (VRB) Low Blue Light Tilt HDMI & VGA Ports",$99.99,4.6 out of 5 stars
"PHILIPS 24 inch Frameless Full HD (1920 x 1080) 100Hz Monitor, VESA, HDMI x1, VGA Port x1, Eye Care, 4 Year Advance Replacement Warranty, 241V8LB",$79.99,4.6 out of 5 stars
"MNN Portable Monitor 15.6inch FHD 1080P USB C HDMI Gaming Ultra-Slim IPS Display w/Smart Cover & Speakers,HDR Plug&Play, External Monitor for Laptop PC Phone Mac",$79.99,4.5 out of 5 stars
"KOORUI 27 Inch Monitor, Full HD 1080P 75Hz Computer Monitor, IPS Display, HDMI, VGA, 5ms Response Time, 75 x 75 mm VESA Mountable, Frameless, Ergonomic Tilt, Black, 27N1",$105.99,4.4 out of 5 stars
"SANSUI Monitor 22 inch IPS 1080P 75hz Computer Monitor, HDMI,VGA Ports with 178°Wide Viewing Angle/Adaptive Sync/Frame-Less/VESA Compatible for Office and Home(ES-22X3)",$69.99,4.4 out of 5 stars
"SANSUI Monitor 27-inch 100Hz PC Monitor, USB Type-C FHD Computer Monitor, HDR/HDMI/Earphone Jack/Frameless/Ergonomic Tilt/VESA Compatible for Game and Office (ES-27F2C, HDMI Cable Included)",$94.99,4.4 out of 5 stars
"KOORUI 22 Inch Computer Monitor, FHD 1080P Desktop Display, 75HZ Ultra Thin Bezel/Eye Care/Ergonomic Tilt, HDMI VGA Ports LED Monitor for PC, VESA Mounting",$69.99,4.5 out of 5 stars
"Sceptre Curved 24-inch Gaming Monitor 1080p R1500 98% sRGB HDMI x2 VGA Build-in Speakers, VESA Wall Mount Machine Black (C248W-1920RN Series)",$79.97,4.6 out of 5 stars
"Amazon Basics Computer Speakers for Desktop or Laptop PC , USB-Powered, Black",$21.37,4.2 out of 5 stars
"LG 24MP60G-B 24"" Full HD (1920 x 1080) IPS Monitor with AMD FreeSync and 1ms MBR Response Time, and 3-Side Virtually Borderless Design - Black",$89.99,4.6 out of 5 stars
"Acer Nitro KG241Y Sbiip 23.8” Full HD (1920 x 1080) VA Gaming Monitor | AMD FreeSync Premium Technology | 165Hz Refresh Rate | 1ms (VRB) | ZeroFrame Design | 1 x Display Port 1.2 & 2 x HDMI 2.0,Black",$99.99,4.5 out of 5 stars
"Sceptre 24-inch Professional Thin 1080p LED Monitor 99% sRGB 2x HDMI VGA Build-in Speakers, Machine Black (E248W-19203R Series)",$93.33,4.5 out of 5 stars
"SAMSUNG 34"" ViewFinity S50GC Series Ultrawide QHD Monitor, 100Hz, 5ms, HDR10, AMD FreeSync, Eye Care, Borderless Design, PIP, PBP, LS34C50DGANXZA, 2023, Black",$199.99,4.4 out of 5 stars
"Packard Bell 21"" FHD Monitor, 1920x1080, Ultrawide, VESA Mount Compatible, Tilt Adjustment, HDMI/VGA, Slim Bezel, for Home, Office, and Light Gaming",$59.99,4.3 out of 5 stars
"Sceptre 20 inch LED Monitor 1600 x 900 HD+ 75Hz HDMI VGA Build-in Speakers, 99% sRGB Wall Mount Ready Black 2021 (E205W-16003RTT)",$59.97,4.2 out of 5 stars
"SANSUI Monitor 24 Inch 100Hz PC Monitor, HDMI VGA Ports VESA Mount, FHD Computer Monitor Ultra-Slim Ergonomic Tilt Eye Care for Home Office (ES-24F2, HDMI Cable Included)",$75.99,4.3 out of 5 stars
"LG UltraGear QHD 27-Inch Gaming Monitor 27GL83A-B - IPS 1ms (GtG), with HDR 10 Compatibility, NVIDIA G-SYNC, and AMD FreeSync, 144Hz, Black",$189.99,4.6 out of 5 stars
"Packard Bell 21"" FHD Monitor, 1920x1080, Ultrawide, VESA Mount Compatible, Tilt Adjustment, HDMI/VGA, Slim Bezel, for Home, Office, and Light Gaming",$59.99,4.3 out of 5 stars
"KOORUI 24 Inch Computer Monitor - FHD 1080P Gaming Monitor 165Hz VA 1ms 1800R LED Monitors with Ultra-Thin, HDMI X2 /DP, VESA Compatible, Tilt Adjustable, Eye Care",$109.99,4.4 out of 5 stars
"Sceptre 20"" 1600x900 75Hz Ultra Thin LED Monitor 2x HDMI VGA Built-in Speakers, Machine Black Wide Viewing Angle 170° (Horizontal) / 160° (Vertical)",$59.97,4.5 out of 5 stars
"ASUS TUF 34 Inch Curved Gaming Monitor - WQHD (3440x1440), 165Hz, 1ms, Extreme Low Motion Blur, FreeSync Premium, Eye Care, Height Adjustable, DisplayHDR 400, DisplayPort, HDMI, USB - VG34VQL1B",$269.00,4.6 out of 5 stars
"ASUS 24” (23.8-inch viewable) Eye Care Monitor (VY249HF) - Full HD, IPS, 100Hz, IPS, SmoothMotion, 1ms, Adaptive Sync, Blue Light Filter, Flicker Free, HDMI, VESA Mountable, 3 Year Warranty",$79.00,4.4 out of 5 stars
"SAMSUNG 27"" T35F Series FHD 1080p Computer Monitor, 75Hz, IPS Panel, HDMI, VGA (D-Sub), 3-Sided Border-Less, FreeSync, LF27T350FHNXZA",$119.99,4.5 out of 5 stars
"Amazon Basics 6 Feet Computer Monitor TV Replacement 3 Prong AC Power Cord, 10 Pack, 18 AWG, 125 Volts, Black",$36.69,4.8 out of 5 stars
NB North Bayou Monitor Desk Mount Ultra Wide Full Motion Swivel Long Arm with Gas Spring for 22''-35''Monitors from 6.6 to 26.4lbs Height Adjustable Monitor Stand G70-W,$69.90,4.5 out of 5 stars
"Dual Monitor Stand for Desk, Vertical Dual Monitor Mount with Wide Range of Motion, Dual Monitor Arm for 17-40"" Screen up to 25 lbs Each, Computer Monitor Stand for 2 Monitors - White",$249.99,4.4 out of 5 stars
"Dell MS5120W Mobile Pro Wireless Mouse – Wireless 2.4GHz, Bluetooth 5.0, Microsoft Swift Pair/Dell Pair (Windows 10 & 11 only), Optical LED Sensor - Black",$34.96,4.6 out of 5 stars
"HEMUDU Single Tall Desk Monitor Arm Mount Stand Fit for 27 inch to 43 inch Flat Curved Computer Screen with Swivel, Height Adjustable, Rotation,Holds up to 77lbs, Black",$31.99,4.3 out of 5 stars
"V2020 Wireless Keyboard and Mouse Combo, White Colorful Wireless Keyboard with Round Keycaps,2.4GHz Dropout-Free Connection,Long Battery Life,Cute Wireless Moues for PC/Laptop/Mac",$39.99,4.4 out of 5 stars
